11:00:39.945 AM	Condition	Participant	ID	TranscribedText	InputStream	PresentedText	WPM	DurationToFirstKey	DurationTyping	INF	C	F	IF	MSDER	TotalErrorRate	NotCorrectedErrorRate	CorrectedErrorRate	FirstKeyCorrect
02:23:45.535 PM	no_blending_inferred	12	the largest of the five oceans	the largest of the five oceans	 ytnbmcxcvbzcxvfgfggdhhthe kl;llaerfggest pof the ficve oceans	the largest of the five oceans	5.84602328980246	1747	63633	0	30	38	32	0	51.6129032258064	0	51.6129032258064	0
02:25:15.363 PM	no_blending_inferred	12	parking tickets can be challenged	parking tickets can be challenged	oippaew rjkkinsdfg toickwets camnmnn hfjk;lgfmnbnbbbbbbbbbbbe channllemehnrtddgred	parking tickets can be challenged	4.91797350562312	2871	82961	0	33	49	49	0	59.7560975609756	0	59.7560975609756	0
03:43:32.903 PM	baseline_typing	13	taking the train is usually faster	taking the train is usually faster	taking the train is usually faster	taking the train is usually faster	48.1596147230822	2059	8721	0	34	0	0	0	0	0	0	1
03:43:45.766 PM	baseline_typing	13	what goes up must come down	what goes up must come down	what goes up must come down	what goes up must come down	49.2885433475136	2028	6817	0	27	0	0	0	0	0	0	1
03:44:02.881 PM	baseline_typing	13	coalition governments never work	coalition governments never work	coalition governments never work	coalition governments never work	34.0293890177881	1467	11637	0	32	0	0	0	0	0	0	1
03:44:17.130 PM	baseline_typing	13	shivering is one way to keep warm	shivering is one way to keep warm	shivering is one way to keep warm	shivering is one way to keep warm	49.1625497047837	1950	8299	0	33	0	0	0	0	0	0	1
03:44:29.463 PM	baseline_typing	13	accompanied by an adult	accompanied by an adult	accompainied by an adult	accompanied by an adult	42.148397482804	1482	6833	0	23	1	1	0	4.16666666666667	0	4.16666666666667	1
03:44:42.346 PM	baseline_typing	13	the bathroom is good for reading	the bathroom is good for reading	the bathroom is good for reading	the bathroom is good for reading	53.8922155688623	1529	7348	0	32	0	0	0	0	0	0	1
03:44:53.128 PM	baseline_typing	13	do not worry about this	do not worry about this	do not worry about this	do not worry about this	61.7495711835335	2106	4664	0	23	0	0	0	0	0	0	1
03:45:04.328 PM	baseline_typing	13	the largest of the five oceans	the largest of the five oceans	the largest of the five oceans	the largest of the five oceans	64.7970736805435	1451	5741	0	30	0	0	0	0	0	0	1
03:45:18.877 PM	baseline_typing	13	the fire blazed all weekend	the fire blazed al weekend	the fire blazed al weekend	the fire blazed all weekend	35.7458075904678	1482	9064	1	26	0	0	3.7037037037037	3.7037037037037	3.7037037037037	0	1
03:45:32.943 PM	baseline_typing	13	the objective of the exercise	the objective of the exercise	the objective of the exercise	the objective of the exercise	40.9183905433053	1264	8798	0	29	0	0	0	0	0	0	1
03:45:42.789 PM	baseline_typing	13	the winner of the race	the winner of the race	the winner of the race	the winner of the race	62.2884224779959	1404	4431	0	22	0	0	0	0	0	0	1
03:45:54.525 PM	baseline_typing	13	the children are playing	the children are playing	the children are playing	the children are playing	48.2005141388175	1498	6224	0	24	0	0	0	0	0	0	1
03:46:10.338 PM	baseline_typing	13	a little encouragement is needed	a little encouragement is needed	a little encouragement is needed	a little encouragement is needed	37.660485021398	1295	10515	0	32	0	0	0	0	0	0	1
03:46:23.640 PM	baseline_typing	13	the king sends you to the tower	the king sends you to the tower	the king sends you to the tower	the king sends you to the tower	50.1305483028721	1638	7660	0	31	0	0	0	0	0	0	1
03:50:40.447 PM	no_blending_inferred	13	win first prize in the contest	win first prize in the contest	woloimn foirst peerize in the contest	win first prize in the contest	15.7506986196968	2293	23618	0	30	7	7	0	18.9189189189189	0	18.9189189189189	1
03:51:03.528 PM	no_blending_inferred	13	goldilocks and the three bears	goldilocks and the three bears	fdfgoldilocks and the three beatrs	goldilocks and the three bears	22.0994475138122	2246	16833	0	30	4	4	0	11.7647058823529	0	11.7647058823529	0
03:51:50.827 PM	no_blending_inferred	13	this mission statement is baloney	this mission statement is baloney	this nmuuidssuiuion srtatenmebnt is cvbaklikjioney	this mission statement is baloney	10.0359128253062	2636	40654	0	33	17	17	0	34	0	34	1
03:52:26.295 PM	no_blending_inferred	13	he is just like everyone else	he is just like everyone else	gfhir e uuyis ghfhjust like everyonr ere else	he is just like everyone else	12.3207501967898	2247	29219	0	29	16	16	0	35.5555555555556	0	35.5555555555556	0
03:52:55.371 PM	no_blending_inferred	13	neither a borrower nor a lender be	neither a borrower nor a lender be	bneuoiuther a vborrower bnoer a lender hbe	neither a borrower nor a lender be	18.5291392773636	2402	22667	0	34	8	8	0	19.047619047619	0	19.047619047619	0
03:53:15.305 PM	no_blending_inferred	13	longer than a football field	longer than a football field	longer rthan a football dfield	longer than a football field	25.5525368969822	2308	13619	0	28	2	2	0	6.66666666666667	0	6.66666666666667	1
03:53:40.731 PM	no_blending_inferred	13	no exchange without a bill	no exchange without a bill	no exvxcjghghanfge without a vbaill	no exchange without a bill	16.7901746385449	2122	19297	0	26	9	9	0	25.7142857142857	0	25.7142857142857	1
03:54:02.463 PM	no_blending_inferred	13	he watched in astonishment	he watched in astonishment	grgfhe watched in asrtonishment	he watched in astonishment	21.885976763037	2917	14804	0	26	5	5	0	16.1290322580645	0	16.1290322580645	0
03:54:20.188 PM	no_blending_inferred	13	the most beautiful sunset	the most beautiful sunset	the most beautiful sunset	the most beautiful sunset	27.1729663821634	2230	11482	0	25	0	0	0	0	0	0	1
03:54:40.445 PM	no_blending_inferred	13	the fire blazed all weekend	the fire blazed all weekend	tyhe fureire blazed all weeknend	the fire blazed all weekend	24.010290124339	2262	13994	0	27	5	5	0	15.625	0	15.625	1
03:54:59.925 PM	no_blending_inferred	13	a touchdown in the last minute	a touchdown in the last minute	a toucjhdown in the last moinute	a touchdown in the last minute	27.7611940298507	2059	13400	0	30	2	2	0	6.25	0	6.25	1
03:55:19.003 PM	no_blending_inferred	13	universities are too expensive	universities are too expensive	iouiniversityies are rotoo expensive	universities are too expensive	29.2590844738084	2356	12714	0	30	6	6	0	16.6666666666667	0	16.6666666666667	0
03:55:45.980 PM	no_blending_inferred	13	good jobs for those with education	good jobs for those with education	tyrfgoofd hjobs for rthose with educatuiion	good jobs for those with education	20.3646237393328	2340	20624	0	34	9	9	0	20.9302325581395	0	20.9302325581395	0
03:56:11.511 PM	no_blending_inferred	13	do you prefer a window seat	do you prefer a window seat	rgdo touregryyou ptrrefer a window seat	do you prefer a window seat	17.5109443402126	2340	19188	0	27	12	12	0	30.7692307692308	0	30.7692307692308	0
03:58:51.397 PM	full_blending_inferred	13	that is a very nasty cut	that is a very nasty cut	that is a very nasty cut	that is a very nasty cut	18.8536953242836	5007	15912	0	24	0	0	0	0	0	0	1
03:59:43.657 PM	full_blending_inferred	13	a steep learning curve in riding a unicycle	a steep learning curve in riding a unicycle	a steep learning curvinge in riding a unictcycycle	a steep learning curve in riding a unicycle	11.8881433782141	3837	44414	0	43	7	7	0	14	0	14	1
04:00:05.644 PM	full_blending_inferred	13	well connected with people	well connectedwith people	well connectedwith people	well connected with people	21.481685486092	3463	14524	1	25	0	0	3.84615384615385	3.84615384615385	3.84615384615385	0	1
04:00:32.539 PM	full_blending_inferred	13	a subject one can really enjoy	a subject one can really enjoy	a subject one can really enjoy	a subject one can really enjoy	19.6109441720702	3916	18969	0	30	0	0	0	0	0	0	1
04:00:52.965 PM	full_blending_inferred	13	bad for the environment	bad for the environment	bad for the environment	bad for the environment	23.1921404412949	4009	12418	0	23	0	0	0	0	0	0	1
04:01:14.896 PM	full_blending_inferred	13	faster than a speeding bullet	faster than a speeding bullet	faster than a speeding bullet	faster than a speeding bullet	26.3119426984359	4227	13682	0	29	0	0	0	0	0	0	1
04:01:35.991 PM	full_blending_inferred	13	have a good weekend	have a good weekend	have a good weekedend	have a good weekend	17.501640778823	3385	13713	0	19	2	2	0	9.52380952380952	0	9.52380952380952	1
04:01:56.631 PM	full_blending_inferred	13	wishful thinking is fine	qushfuk thinking is fine	qushfuk thinking is fine	wishful thinking is fine	25.9515570934256	5070	11560	3	21	0	0	12.5	12.5	12.5	0	0
04:02:25.720 PM	full_blending_inferred	13	an excellent way to communicate	an excellent way to communicate	an excellent way rito communicatione	an excellent way to communicate	18.6897692981602	4539	20546	0	31	5	5	0	13.8888888888889	0	13.8888888888889	1
04:03:06.788 PM	full_blending_inferred	13	a good stimulus deserves a good response	a giid stimulus deserves a good response	a giid stimlus ulus deserves a fgood response	a good stimulus deserves a good response	15.3323568824208	4961	32089	2	38	5	5	5	15.5555555555556	4.44444444444444	11.1111111111111	1
04:03:32.587 PM	full_blending_inferred	13	tell a lie and your nose will grow	tell a lie and your nose will grow	tekkll a lie and your nose will grow	tell a lie and your nose will grow	23.4113712374582	3854	17940	0	34	2	2	0	5.55555555555556	0	5.55555555555556	1
04:03:53.223 PM	full_blending_inferred	13	love means many things	love means many things	love means many thinkgs	love means many things	23.495360517579	4883	11747	0	22	1	1	0	4.34782608695652	0	4.34782608695652	1
04:04:22.329 PM	full_blending_inferred	13	a glance in the right direction	a glance in the rigght directions	a gkance =lance in the rihigght directions	a glance in the right direction	18.9652768093711	3588	21513	2	31	9	9	6.06060606060606	26.1904761904762	4.76190476190476	21.4285714285714	1
04:04:48.061 PM	full_blending_inferred	13	the assignment is due today	the assignment is duw today	the assignment is fduw today	the assignment is due today	18.9594853853967	4009	17722	1	26	1	1	3.7037037037037	7.14285714285714	3.57142857142857	3.57142857142857	1
04:06:19.455 PM	partial_blending_inferred_green	13	companies announce a merger	companies announce a merger	companies announce a merfger	companies announce a merger	21.2833343890543	6474	15787	0	27	1	1	0	3.57142857142857	0	3.57142857142857	1
04:06:42.535 PM	partial_blending_inferred_green	13	not quite so smart as you think	not quite as smart as you think	not quite as smart as you think	not quite so smart as you think	29.0622871414516	5866	13213	2	30	0	0	6.25	6.25	6.25	0	1
04:07:02.047 PM	partial_blending_inferred_green	13	yes you are very smart	yes you are very smart	yes you are very smart	yes you are very smart	23.620025673941	3822	11685	0	22	0	0	0	0	0	0	1
04:07:22.895 PM	partial_blending_inferred_green	13	the high waves will swamp us	the high waves will swamp us	the high wavsees will swamp us	the high waves will swamp us	26.0908681961314	3495	13338	0	28	2	2	0	6.66666666666667	0	6.66666666666667	1
04:07:43.477 PM	partial_blending_inferred_green	13	valid until the end of the year	valid until the end of the year	valid until the end of the year	valid until the end of the year	28.3583191787903	3042	13541	0	31	0	0	0	0	0	0	1
04:07:57.270 PM	partial_blending_inferred_green	13	the winner of the race	the winner of the race	the winner of the race	the winner of the race	41.8245188664949	3182	6599	0	22	0	0	0	0	0	0	1
04:08:20.402 PM	partial_blending_inferred_green	13	the water was monitored daily	the water was nobitored daily	the water was nobitored daily	the water was monitored daily	23.8901055146327	4056	15069	2	27	0	0	6.89655172413793	6.89655172413793	6.89655172413793	0	1
04:08:43.929 PM	partial_blending_inferred_green	13	exercise is good for the mind	exercise is good for the mind	exercise is good doefor the mind	exercise is good for the mind	22.5804428275732	3573	15943	0	29	3	3	0	9.375	0	9.375	1
04:09:00.443 PM	partial_blending_inferred_green	13	breathing is difficult	breathing is difficult	breathing is fdifficult	breathing is difficult	30.9278350515464	3588	8924	0	22	1	1	0	4.34782608695652	0	4.34782608695652	1
04:09:26.541 PM	partial_blending_inferred_green	13	soon we will return from the city	soon we will return from the city	xssonnon we will return from th e cuity	soon we will return from the city	27.0736562707366	7020	15070	0	33	6	6	0	15.3846153846154	0	15.3846153846154	0
04:09:49.263 PM	partial_blending_inferred_green	13	victims deserve more redress	victims deserves more redress	victims deserves more redreesess	victims deserve more redress	24.9221183800623	4259	14445	1	28	3	3	3.44827586206897	12.5	3.125	9.375	1
04:10:08.549 PM	partial_blending_inferred_green	13	jumping right out of the water	jumping right out of the water	jumping right our t of the water	jumping right out of the water	32.0938659304633	3697	11591	0	30	2	2	0	6.25	0	6.25	1
04:10:30.096 PM	partial_blending_inferred_green	13	a very traditional way to dress	a vwey tradtional way to dress	a vwey tradtiobnal way to dress	a very traditional way to dress	26.7934312878133	3650	13884	3	29	1	1	9.375	12.1212121212121	9.09090909090909	3.03030303030303	1
04:10:58.429 PM	partial_blending_inferred_green	13	the punishment should fit the crime	the punishment should fit the crime	the punishment shouklld fit the scruneime	the punishment should fit the crime	20.6817311374952	3432	20888	0	35	6	6	0	14.6341463414634	0	14.6341463414634	1
10:06:27.919 AM	baseline_typing	14	on the way to the cottage	on the way to the cottage	on the way to the cottage	on the way to the cottage	50	1856	6240	0	25	0	0	0	0	0	0	1
10:06:39.533 AM	baseline_typing	14	we went grocery shopping	we went grocery shopping	we went grocery shopping	we went grocery shopping	48.5594043379734	1420	6178	0	24	0	0	0	0	0	0	1
10:06:52.650 AM	baseline_typing	14	the four seasons will come	the four seasons will come	the four seasons will come	the four seasons will come	47.2027972027972	2231	6864	0	26	0	0	0	0	0	0	1
10:07:04.017 AM	baseline_typing	14	just in time for the party	just in time for the party	just in time for the party	just in time for the party	60.7310215557638	2028	5335	0	26	0	0	0	0	0	0	1
10:07:17.684 AM	baseline_typing	14	I listen to the tape everyday	I listen to the tape everyday	I listen to the tape everyday	I listen to the tape everyday	47.3871264973016	2059	7597	0	29	0	0	0	0	0	0	1
10:07:29.634 AM	baseline_typing	14	you will loose your voice	you will loose your voice	you will loose your voice	you will loose your voice	54.2043085476025	2184	5756	0	25	0	0	0	0	0	0	1
10:07:42.119 AM	baseline_typing	14	gas bills are sent monthly	gas bills are sent monthly	gas bills are sent monthly	gas bills are sent monthly	54.0901502504174	2481	5990	0	26	0	0	0	0	0	0	1
10:07:54.036 AM	baseline_typing	14	play it again Sam	play it again Sam	play it again SAmam	play it again Sam	38.7791741472172	2340	5570	0	17	2	2	0	10.5263157894737	0	10.5263157894737	1
10:08:10.583 AM	baseline_typing	14	dormitory doors are locked at midnight	dormitory doors are locked at midnight	dormitory doors are locked at midnight	dormitory doors are locked at midnight	52.1739130434783	3572	8970	0	38	0	0	0	0	0	0	1
10:08:23.350 AM	baseline_typing	14	no exchange without a bill	no exchange without a bill	no exchange without a bill	no exchange without a bill	48.3005366726297	2043	6708	0	26	0	0	0	0	0	0	1
10:08:35.155 AM	baseline_typing	14	the most beautiful sunset	the most beutiful sunset	the most beutiful sunset	the most beautiful sunset	51.8313752591569	2013	5788	1	24	0	0	4	4	4	0	1
10:08:46.205 AM	baseline_typing	14	join us on the patio	join us on the patio	join us on the patio	join us on the patio	51.9480519480519	2184	4851	0	20	0	0	0	0	0	0	1
10:09:03.054 AM	baseline_typing	14	I cannot believe I ate the whole thing	I cannot believe I ate the whole thing	I cannot believe I ate the qwwhole thing	I cannot believe I ate the whole thing	44.9093177238269	2418	10421	0	38	2	2	0	5	0	5	1
10:09:16.786 AM	baseline_typing	14	chemical spill took forever	chemical spill took forever	chemical spill took forever	chemical spill took forever	47.3372781065089	2621	7098	0	27	0	0	0	0	0	0	1
10:12:54.531 AM	no_blending_inferred	14	look in the syllabus for the course	look in the syllabus for the course	look in the sutyllabus for the course	look in the syllabus for the course	23.5885115212406	1623	18314	0	35	2	2	0	5.40540540540541	0	5.40540540540541	1
10:13:14.807 AM	no_blending_inferred	14	information super highway	information super highway	information super hifhghway	information super highway	21.2086194004486	1560	14711	0	25	2	2	0	7.40740740740741	0	7.40740740740741	1
10:13:53.366 AM	no_blending_inferred	14	put garbage in an abandoned mine	put garbage in an abandoned mine	put dfgarvbafege ubin abn abanfghdinioobned mine	put garbage in an abandoned mine	12.0764844012076	1763	32791	0	32	16	16	0	33.3333333333333	0	33.3333333333333	1
10:14:22.261 AM	no_blending_inferred	14	you have my sympathy	you have my sympathy	you have myu suytynmnoathoapatghey	you have my sympathy	10.9076743280094	1779	23103	0	20	14	14	0	41.1764705882353	0	41.1764705882353	1
10:15:11.941 AM	no_blending_inferred	14	one heck of a question	one heck  oh a question	obmnbnbmmne ghecjjkk ohjkj ohghkljgh a qyetyuestuiuuion	one heck of a question	6.6455915268708	2340	43337	2	21	32	32	8.69565217391304	61.8181818181818	3.63636363636364	58.1818181818182	1
10:15:38.441 AM	no_blending_inferred	14	these barracks are big enough	tgese barracjs are big enough	tgese vabarracjs are vbuuig ebniyough	these barracks are big enough	17.1192163203196	1466	21029	2	27	8	8	6.89655172413793	27.027027027027	5.40540540540541	21.6216216216216	1
10:16:12.947 AM	no_blending_inferred	14	correct your diction immediately	correct your diction immediately	correct yiour fducuiicthuuion immediately	correct your diction immediately	13.632608096943	1451	29048	0	32	9	9	0	21.9512195121951	0	21.9512195121951	1
10:16:38.862 AM	no_blending_inferred	14	what a lovely red jacket	what a lovely red jacket	qwaghjhhartt a kilovely ewred jackets	what a lovely red jacket	14.4920535239843	1201	20701	0	24	13	13	0	35.1351351351351	0	35.1351351351351	0
10:17:12.609 AM	no_blending_inferred	14	a glance in the right direction	a glance in the right direction	a fgklabmnce in the tridfght dureuirectuiion	a glance in the right direction	14.2201155384388	2745	27004	0	31	13	13	0	29.5454545454545	0	29.5454545454545	1
10:17:53.276 AM	no_blending_inferred	14	a big scratch on the tabletop	a big scratch on the tabletop	a vbuuig scrach tcgjh obnbn tghe tavvble top	a big scratch on the tabletop	10.7433823748844	3151	33509	0	29	15	15	0	34.0909090909091	0	34.0909090909091	1
10:18:22.395 AM	no_blending_inferred	14	I took the rover from the shop	I took the rover from the shop	I took the trover fromn tgehe sgghiop	I took the rover from the shop	16.299347149805	2293	22823	0	30	7	7	0	18.9189189189189	0	18.9189189189189	1
10:19:16.364 AM	no_blending_inferred	14	gun powder must be handled with care	gun powder must be handled with care	"guybmbnbm,mnubnm powfder mysust vbe gajkfgffhgabndkled witgh care"	gun powder must be handled with care	9.14276300887507	1404	48563	0	36	29	29	0	44.6153846153846	0	44.6153846153846	1
10:19:50.798 AM	no_blending_inferred	14	my car always breaks in the winter	my car always breaks in the winter	my car always vvbbreaks ubibn tghe qwuibnbnrtter	my car always breaks in the winter	15.1166138784912	2636	27784	0	34	14	14	0	29.1666666666667	0	29.1666666666667	1
10:20:12.098 AM	no_blending_inferred	14	the power of denial	the power of denial	tghje powert of debnuial	the power of denial	16.1095449053564	2403	14898	0	19	5	5	0	20.8333333333333	0	20.8333333333333	1
10:22:16.542 AM	partial_blending_inferred_green	14	this leather jacket is too warm	this leather jacket is too warm	this leather jacket is too warm	this leather jacket is too warm	29.6914868939921	3837	12933	0	31	0	0	0	0	0	0	1
10:22:41.448 AM	partial_blending_inferred_green	14	do you like to shop on Sunday	do you like the shop on Sunday	do you like the shop on sundaySunday	do you like to shop on Sunday	21.5990245601812	3666	17223	2	28	6	6	6.66666666666667	22.2222222222222	5.55555555555556	16.6666666666667	1
10:23:03.373 AM	partial_blending_inferred_green	14	exceed the maximum speed limit	exceed the maximum speed limit	weexceed the maximum speed limit	exceed the maximum speed limit	25.8082419869571	3510	14414	0	30	2	2	0	6.25	0	6.25	0
10:23:25.510 AM	partial_blending_inferred_green	14	well connected with people	well connected with people	well connectyed wiyith people	well connected with people	21.8623481781377	3323	14820	0	26	3	3	0	10.3448275862069	0	10.3448275862069	1
10:23:47.262 AM	partial_blending_inferred_green	14	I am going to a music lesson	I am going to a music lesson	I am hgioing to a music lesson	I am going to a music lesson	23.2620320855615	2793	14960	0	28	2	2	0	6.66666666666667	0	6.66666666666667	1
10:24:08.007 AM	partial_blending_inferred_green	14	the bathroom is good for reading	the bathroom is good for reading	the bathroom is good for readingh	the bathroom is good for reading	29.5853567426223	3354	13385	0	32	1	1	0	3.03030303030303	0	3.03030303030303	1
10:24:24.296 AM	partial_blending_inferred_green	14	the back yard of our house	the back yard of our house	the back yard of our house	the back yard of our house	41.8712845696562	4539	7738	0	26	0	0	0	0	0	0	1
10:24:45.740 AM	partial_blending_inferred_green	14	a little encouragement is needed	a little encouragement is needed	a little encouragement is needed	a little encouragement is needed	29.4818344252531	3994	13432	0	32	0	0	0	0	0	0	1
10:25:11.029 AM	partial_blending_inferred_green	14	drove my chevy to the levee	drove my chevy to the levee	drove my shchevty to the levee	drove my chevy to the levee	19.8875406925126	4383	16895	0	27	3	3	0	10	0	10	1
10:25:27.986 AM	partial_blending_inferred_green	14	accompanied by an adult	accompanied by an adult	accompanied by an adult	accompanied by an adult	28.8	2948	10000	0	23	0	0	0	0	0	0	1
10:25:45.899 AM	partial_blending_inferred_green	14	do not worry about this	do not worry about this	do not worry abouiut this	do not worry about this	27.3894436519258	3385	10515	0	23	2	2	0	8	0	8	1
10:26:02.295 AM	partial_blending_inferred_green	14	we better investigate this	we better investigate this	we better investigate this	we better investigate this	36.7597004765146	3572	8814	0	26	0	0	0	0	0	0	1
10:26:17.681 AM	partial_blending_inferred_green	14	can we play cards tonight	can we play cards tonight	can we play cards tonight	can we play cards tonight	36.692931906386	2886	8503	0	25	0	0	0	0	0	0	1
10:26:33.986 AM	partial_blending_inferred_green	14	chemical spill took forever	chemical spill took forever	chemical spill took forever	chemical spill took forever	38.8080388080388	3635	8658	0	27	0	0	0	0	0	0	1
10:31:05.506 AM	full_blending_inferred	14	it should be sunny tomorrow	it should be sunny tomorrow	it should be sunny tommorrow	it should be sunny tomorrow	28.6030475866179	3526	11747	0	27	1	1	0	3.57142857142857	0	3.57142857142857	1
10:31:21.358 AM	full_blending_inferred	14	we run the risk of failure	we run the risk of failure	we run the risk of failure	we run the risk of failure	36.6308648954211	2995	8845	0	26	0	0	0	0	0	0	1
10:31:41.231 AM	full_blending_inferred	14	bank transaction was not registered	bank transaction was not registered	bank transaction was not registered	bank transaction was not registered	35.5497037524687	3713	12152	0	35	0	0	0	0	0	0	1
10:31:55.599 AM	full_blending_inferred	14	the sun rises in the east	the sun rises in the east	the sun rises in the east	the sun rises in the east	43.8571830193984	3245	7114	0	25	0	0	0	0	0	0	1
10:32:20.704 AM	full_blending_inferred	14	one hour is allotted for questions	one hour is allotted for questions	one hour is allotted tofor wquestions	one hour is allotted for questions	23.3501973647634	3104	17987	0	34	3	3	0	8.10810810810811	0	8.10810810810811	1
10:32:36.632 AM	full_blending_inferred	14	a touchdown in the last minute	a touchdown in the last minute	a touchdown in the last minute	a touchdown in the last minute	43.2005574265474	3307	8611	0	30	0	0	0	0	0	0	1
10:33:07.541 AM	full_blending_inferred	14	suburbs are sprawling up everywhere	suburbs are sprawling up everywhere	subuirbs are sprawling up everythwhwhere	suburbs are sprawling up everywhere	18.3509621511406	3354	23541	0	35	5	5	0	12.5	0	12.5	1
10:33:25.369 AM	full_blending_inferred	14	the registration period is over	the registration period is over	the registration period is over	the registration period is over	36.5749118963711	3323	10499	0	31	0	0	0	0	0	0	1
10:33:44.199 AM	full_blending_inferred	14	destruction of the rain forest	destruction of the rain forest	destruyction of the rain forest	destruction of the rain forest	30.4943028117059	2621	12199	0	30	1	1	0	3.2258064516129	0	3.2258064516129	1
10:34:01.888 AM	full_blending_inferred	14	he watched in astonishment	he watched in astonishment	he watched in astonishment	he watched in astonishment	32.4486730095143	3697	9985	0	26	0	0	0	0	0	0	1
10:34:18.567 AM	full_blending_inferred	14	your presentation was inspiring	your presentation was inspiring	your presentation was inspiring	your presentation was inspiring	39.1357521402364	2855	9812	0	31	0	0	0	0	0	0	1
